python/sglang/srt/layers/quantization/configs/N=32768,K=512,device_name=AMD_Instinct_MI300X,dtype=int8_w8a8,block_shape=[128, 128].json
{
  "1": {
    "BLOCK_SIZE_M": 64,
    "BLOCK_SIZE_N": 64,
    "BLOCK_SIZE_K": 128,
    "GROUP_SIZE_M": 4,
    "num_warps": 4,
    "num_stages": 2
  },
  "2": {
    "BLOCK_SIZE_M": 64,
    "BLOCK_SIZE_N": 64,
    "BLOCK_SIZE_K": 128,
    "GROUP_SIZE_M": 4,
    "num_warps": 4,
    "num_stages": 2
  },
  "4": {
    "BLOCK_SIZE_M": 64,
    "BLOCK_SIZE_N": 64,
    "BLOCK_SIZE_K": 128,
    "GROUP_SIZE_M": 8,
    "num_warps": 4,
    "num_stages": 2
  },
  "8": {
    "BLOCK_SIZE_M": 64,
    "BLOCK_SIZE_N": 64,
    "BLOCK_SIZE_K": 128,
    "GROUP_SIZE_M": 8,
    "num_warps": 4,
    "num_stages": 2
  },
  "16": {
    "BLOCK_SIZE_M": 64,
    "BLOCK_SIZE_N": 64,
    "BLOCK_SIZE_K": 128,
    "GROUP_SIZE_M": 8,
    "num_warps": 4,
    "num_stages": 2
  },
  "32": {
    "BLOCK_SIZE_M": 64,
    "BLOCK_SIZE_N": 64,
    "BLOCK_SIZE_K": 128,
    "GROUP_SIZE_M": 8,
    "num_warps": 4,
    "num_stages": 2
  },
  "64": {
    "BLOCK_SIZE_M": 64,
    "BLOCK_SIZE_N": 64,
    "BLOCK_SIZE_K": 128,
    "GROUP_SIZE_M": 4,
    "num_warps": 4,
    "num_stages": 2
  },
  "128": {
    "BLOCK_SIZE_M": 64,
    "BLOCK_SIZE_N": 64,
    "BLOCK_SIZE_K": 128,
    "GROUP_SIZE_M": 4,
    "num_warps": 4,
    "num_stages": 2
  }
}